{
  "$schema": "http://json-schema.org/draft-07/schema#",
  "$id": "https://uxr.local/schemas/correction.schema.json",
  "title": "Correction Record",
  "description": "A durable record of a human correction/change request, applied by the learning loop (pipeline/loop.md) to a permanent artifact so the same mistake does not recur.",
  "type": "object",
  "required": ["id", "study_id", "run_model", "target", "problem", "root_cause", "correction", "change", "status"],
  "additionalProperties": false,
  "properties": {
    "id": { "type": "string", "pattern": "^COR-[0-9]{4}-[0-9]{2}-[0-9]{2}-[0-9]{2}$", "description": "COR-YYYY-MM-DD-NN." },
    "study_id": { "type": "string", "minLength": 1 },
    "run_model": { "type": "string", "enum": ["opus-4.8", "gpt-5.5", "both", "n/a"] },
    "target": { "type": "string", "enum": ["finding", "agent", "skill", "eval", "schema", "workflow", "config", "data"] },
    "target_id": { "type": "string", "description": "e.g. editor, humanizer, devils-advocate, interpretation_support, roster." },
    "problem": { "type": "string", "minLength": 3, "description": "What was wrong, in the human's words." },
    "root_cause": { "type": "string", "enum": ["prompt", "skill-gap", "rubric", "schema", "data", "model", "process"] },
    "correction": { "type": "string", "minLength": 3, "description": "The specific fix that was requested." },
    "change": { "type": "string", "minLength": 3, "description": "What changed in the repo so it does not recur." },
    "status": { "type": "string", "enum": ["open", "applied"] },
    "created_at": { "type": "string" },
    "applied_at": { "type": "string" },
    "source_turn": { "type": "integer", "minimum": 0, "description": "Conversation turn the correction came from, for traceability." },
    "changelog_ref": { "type": "string", "description": "CHANGELOG entry id (e.g. LEARN-01) once applied." }
  }
}
