{
  "id": "COR-2026-07-15-06",
  "study_id": "vscode-voice-chat",
  "run_model": "n/a",
  "target": "workflow",
  "target_id": "learning-loop",
  "problem": "The learning loop never actually fired, so the same voice, roster, and over-reading mistakes kept recurring.",
  "root_cause": "process",
  "correction": "Make each correction a durable record the retrospective applies every run.",
  "change": "Added lib/corrections.mjs and correction.schema.json and wired the CP3 routine into loop.md and the learning-loop skill.",
  "status": "applied",
  "created_at": "2026-07-15T02:33:55.148Z",
  "applied_at": "2026-07-15T02:33:55.183Z",
  "changelog_ref": "LEARN-06"
}