{
  "id": "COR-2026-07-15-01",
  "study_id": "vscode-voice-chat",
  "run_model": "opus-4.8",
  "target": "skill",
  "target_id": "humanizer",
  "problem": "The report called people \"developers\" and used em dashes and hedging. I fixed the voice by hand across several turns.",
  "root_cause": "skill-gap",
  "correction": "Enforce the house voice automatically and capture a writing-style sample at intake.",
  "change": "Added lib/stylelint.mjs (hard + soft gate) and config.style, plus a required inputs/style-samples/ check at intake.",
  "status": "applied",
  "created_at": "2026-07-15T02:33:54.788Z",
  "source_turn": 11,
  "applied_at": "2026-07-15T02:33:54.825Z",
  "changelog_ref": "LEARN-01"
}