{
  "id": "COR-2026-07-15-05",
  "study_id": "vscode-voice-chat",
  "run_model": "n/a",
  "target": "agent",
  "target_id": "conductor",
  "problem": "The conductor was opaque. I could not tell which step was running or how to cancel.",
  "root_cause": "prompt",
  "correction": "Show per-step progress, keep a stable task name, and give a clear cancel path.",
  "change": "Added a Visibility behavior to the conductor charter and the pipeline-orchestration skill.",
  "status": "applied",
  "created_at": "2026-07-15T02:33:55.079Z",
  "source_turn": 6,
  "applied_at": "2026-07-15T02:33:55.113Z",
  "changelog_ref": "LEARN-05"
}