{
  "id": "COR-2026-07-15-02",
  "study_id": "vscode-voice-chat",
  "run_model": "opus-4.8",
  "target": "config",
  "target_id": "roster",
  "problem": "An observer and the product's own \"Agent\" voice were counted as participants, so the report claimed 8 of 7.",
  "root_cause": "data",
  "correction": "Separate observers and facilitators and the product voice from real participants.",
  "change": "Added a roster role (P/OBS/FAC codes) in pii.buildKey and config.analysis.nonParticipantSpeakers; saturation excludes them.",
  "status": "applied",
  "created_at": "2026-07-15T02:33:54.862Z",
  "source_turn": 12,
  "applied_at": "2026-07-15T02:33:54.892Z",
  "changelog_ref": "LEARN-02"
}