{
  "id": "COR-2026-07-15-04",
  "study_id": "vscode-voice-chat",
  "run_model": "n/a",
  "target": "workflow",
  "target_id": "requests",
  "problem": "A mid-session ask about settings defaults was dropped and never made it into the report.",
  "root_cause": "process",
  "correction": "Track every researcher ask and block sign-off until each one is addressed.",
  "change": "Added lib/requests.mjs and a CP3 researcher-request gate in workflow.md and the conductor charter.",
  "status": "applied",
  "created_at": "2026-07-15T02:33:55.015Z",
  "source_turn": 37,
  "applied_at": "2026-07-15T02:33:55.044Z",
  "changelog_ref": "LEARN-04"
}