{
  "id": "COR-2026-07-15-03",
  "study_id": "vscode-voice-chat",
  "run_model": "opus-4.8",
  "target": "eval",
  "target_id": "interpretation_support",
  "problem": "The report invented \"two modes\" and over-read an attribution, yet the evals passed with 0 unsupported.",
  "root_cause": "rubric",
  "correction": "Flag enumerated categories and attributions that the cited quotes do not support.",
  "change": "Added the interpretation_support soft eval in lib/evals.mjs and an over-reading item to the Devil's Advocate charter.",
  "status": "applied",
  "created_at": "2026-07-15T02:33:54.923Z",
  "source_turn": 24,
  "applied_at": "2026-07-15T02:33:54.956Z",
  "changelog_ref": "LEARN-03"
}