{
  "id": "COR-2026-07-15-07",
  "study_id": "vscode-voice-chat",
  "run_model": "opus-4.8",
  "target": "config",
  "target_id": "export",
  "problem": "Building the Word doc and embedding clip links was fully manual after the report was written.",
  "root_cause": "process",
  "correction": "Export the docx automatically with the Marvin clip links baked in.",
  "change": "Added lib/export.mjs (zero-dependency md to docx) and config.export; Editor and Storyteller export after CP3.",
  "status": "applied",
  "created_at": "2026-07-15T02:33:55.213Z",
  "applied_at": "2026-07-15T02:33:55.245Z",
  "changelog_ref": "LEARN-07"
}